{
  "term": "urn:solid:Person",
  "termRegistry": "https://urn-solid.com/Person/",
  "pane": "https://losos.org/panes/schema-pane.js",
  "schema": "https://solid-schema.github.io/Person/index.json",
  "label": "Person",
  "icon": "\ud83d\udc64",
  "description": "Generic schema-driven Person editor.",
  "status": "stable",
  "added": "2026-04-19",
  "curatedBy": "claude-curate-next"
}
