{
  "term": "urn:solid:Document",
  "termRegistry": "https://urn-solid.com/Document/",
  "pane": "https://losos.org/panes/schema-pane.js",
  "schema": "https://solid-schema.github.io/Document/index.json",
  "label": "Document",
  "icon": "\ud83d\udcc4",
  "description": "Schema-driven Document editor.",
  "status": "stable",
  "added": "2026-04-19",
  "curatedBy": "claude-curate-next"
}
