{
  "term": "urn:solid:AddressBook",
  "termRegistry": "https://urn-solid.com/AddressBook/",
  "pane": "https://losos.org/panes/schema-pane.js",
  "schema": "https://solid-schema.github.io/AddressBook/index.json",
  "label": "AddressBook",
  "icon": "\ud83d\udcd2",
  "description": "Schema-driven AddressBook editor.",
  "status": "stable",
  "added": "2026-04-19",
  "curatedBy": "claude-curate-next"
}
