{
  "term": "urn:solid:VerifiableCredential",
  "termRegistry": "https://urn-solid.com/VerifiableCredential/",
  "pane": "https://losos.org/panes/schema-pane.js",
  "schema": "https://solid-schema.github.io/VerifiableCredential/index.json",
  "label": "Credential",
  "icon": "\ud83c\udfc6",
  "description": "Schema-driven VerifiableCredential editor.",
  "status": "experimental",
  "added": "2026-04-19",
  "curatedBy": "claude-curate-next"
}
