{
  "term": "urn:solid:Article",
  "termRegistry": "https://urn-solid.com/Article/",
  "pane": "https://losos.org/panes/schema-pane.js",
  "schema": "https://solid-schema.github.io/Article/index.json",
  "label": "Article",
  "icon": "\ud83d\udcf0",
  "description": "Schema-driven Article editor.",
  "status": "stable",
  "added": "2026-04-19",
  "curatedBy": "claude-curate-next"
}
